{
  "version": "draft-0.1",
  "request_id": "11111111-1111-4111-8111-111111111111",
  "trace_id": "22222222-2222-4222-8222-222222222222",
  "operation": "task.postpone",
  "message": "資料作成を9月22日に延期して",
  "locale": "ja-JP",
  "time_zone": "Asia/Tokyo",
  "proposal_id": null,
  "expected_revision": null,
  "candidate_ref": null
}
